<?xml version="1.0" encoding="UTF-8"?>
<!-- XML的标志,少了这个就不是XML -->
<!--  引入DTD： <!DOCTYPE 根节点 SYSTEM  "dtd的地址">-->
<!--<!DOCTYPE persons  SYSTEM "person.dtd">-->
<!DOCTYPE persons  SYSTEM "person.dtd">

<persons>

    <person pid="p1" sex="男" qq="aaa" parent="p2">
        <name>张小明</name>
        <age>10</age>
        <girl>
            <color></color>
        </girl>
        <contact>
            <phone>1234567</phone>
        </contact>
        <br/>

    </person>

    <person pid="p2">
        <name>张大明</name>
        <age>10</age>
        <girl>
            <color></color>
        </girl>
        <contact>
            <email>123@qq.com</email>
        </contact>
    </person>



</persons>
